1,Raccoons are omnivorous animals but they have a preference for this type of food.,Fruits and nuts,Invertebrates,Birds,Fish
2,What animals do wolves generally prefer to feed on?,Ungulates,Rodents,Birds,Fish
2,All but one of the following are true types of bears. Which is the odd one?,Moon bear,Brown bear,Black bear,Sun bear
2,What are cheetahs that have mutated patterning that creates blotches instead of spots called?,King Cheetahs,Smudge Cheetahs,Black Cheetahs,Striped Cheetahs
0,What is the largest wolf species on the planet as well as the largest wild representative of the Canidae family?,Grey wolf,Polar wolf,Black wolf,Red wolf
1,Name the rarest and most endangered of all wolves.,Red Wolf,Ethiopian Wolf,Black-backed Wolf,Gray Wolf
0," This extraordinary marine mammal is often considered a whale, but it is actually a dolphin.",All of these,Killer Whale,Blackfish,Seawolf
0," What is the meaning of the word Sarcophilus, the name of the genus that the Tasmanian devil belongs to?",Meat-lover,Devil creature,Blood-lover,Dog-like
2,Which of these sharks has a flat body like a stingray?,angel shark,basking shark,blue shark,blacktip reef shark
0,Which one of these sea mammals is not in the endangered species lists?,Pilot whale,Fin Whale,Blue Whale,Humpback Whale
1," What notable feature does the Fennec Fox possess, that makes it easily recognizable?",Very large ears,It has no tail,Bluish fur,Red eyes
2,This extremely large and tall German dog breed has a very short shiny coat and strong muscular body with a majestic posture.,All of these,German Mastiff,Boarhound,Great Dane
2," This dog breed, considered one of the first sighthound dog breeds, has very long fur and is quite tall, with long legs and ears.",Afghan Hound,Canadian Pointer,Bolognese,Airedale Terrier
0,What is the largest living bird of prey on the planet?,Eurasian Black Vulture,Philippine Eagle,Booted Eagle,Lappet-faced Vulture
0," Cats twitch the tips of their tails slightly when hunting or when angry, while stronger twitching indicates what?",Displeasure,Stress,Boredom,Playfulness
1,Which of these statements is true about the King Penguin?,All of these,They are serially monogamous.,Both parents take part in the incubation.,The female lays 1 single egg.
2," Narwhals and belugas make up separate subspecies of cetaceans. However, taxonomists often include in it a dolphin which lives in Indo-Pacific waters. What is the name of this dolphin?",Irrawaddy dolphin,Bottlenose dolphin,Boto,Risso’s dolphin
1,What plant is poisonous for guinea pigs and should never be offered to them?,All of these,All plants growing from a bulb,Bracken,Wild celery
0," In nature, chinchillas can be found in only one color. Which one is it?",Grey,Black,Brown,Beige
0,Which of the following is not a type of spider?,Glass spider,Trapdoor spider,Brown recluse spider,Bird-dropping spider
2," In cetaceans, the species identification “rorqual” comes from the Norwegian word “rorhval” which means “furrow.” These furrows are obvious on all rorqual whales. Which of the following is not a rorqual whale?",Beluga whale,Sei whale,Bryde’s whale,Minke whale
2," What common name is used to denote the dolphin species Sotalia fluviatilis, indigenous to South America?",All of these,Tucuxi,Bufeo gris,Bufeo negro
0,This type of ant is considered the most venomous of all insects.,Jack jumper ant,Western brown ant,Bulldog ant,Fire ant
0,This type of ant causes a lot of allergic reactions in the USA.,Fire ant,Jack Jumper  ant,Bulldog ant,Western brown ant
2,Which statement about ants is untrue?,Anteaters prefer ants to any other type of food.,An ant colony will eat its own larvae if there is no other food around.,Bullet ants are considered to have the most painful sting.,Ants are sometimes put into Thai salads.
2,How do wolves mark their territory?,All of these,By urinating,By defecating,By rubbing against objects
0,How do elephants protect their skin from the aggressive UV-radiation?,By wallowing in mud,By wallowing in their own feces,By hiding in the shadow of thick branches,None of these
2," According to statistics, how are wolves killed today?",All of these,By people,By hunters and poachers,By poison and areal hunters
1," This large cat breed, created in the United States, has rabbit-like fur of medium length, rectangular body, and a fatty pad in the lower abdomen.",Ragamuffin,Balinese,California Spangled Cat,Munchkin
0,What term is commonly used to refer to the young of the guinea pig?,Pups,Kits,Calves,Piglets
0,In which country is the grizzly bear listed as a threatened species?,U.S.,Germany,Canada,Sweden
1,What is the smallest frog?,Brazilian Gold Frog,Red-Eyed Tree frog,Cane Toad,Monte Iberia Eleuth
2,Which of these statements is true about the consumption of plant material by carnivores?,All of these,Carnivores consume feces of herbivores to get nutrients.,"Carnivores consume some plant material in order to get minerals, vitamins and fiber.",Carnivores ingest the plant material the need along with their herbivorous prey.
2," The large tsetse fly, found in Africa, feeds on what?",Blood,All of these,Carrion,Nectar
0,The Northern Short-tailed Shrew is a small venomous mammal that populates this area.,North America,Europe,Central America and the northern parts of South America,North and Northeast Asia
1," What is the natural habitat of the snows leopard, that was hunted down for its beautiful fur, as a result of which its population went down to 1,000 animals in the 1960s?",Central Asia,North America,Central Asia and North America,Europe and North America
1,What is the word used for someone that is afraid of chickens?,Alektorphobic,Xenophobic,Chickopobic,Avianphobic
2," According to Chinese mythology, what shape do fox spirits known as huli jing take in the real world?",Women,Cats,Children,Bushes
0,In what country did the American Akita dog breed originate?,Japan,Canada,China,United States
1,Which is the wrong statement about chinchilla breeding?,Chinchillas have a 45-day gestation period.,Chinchilla litters predominately consist of twins.,Chinchillas can breed any time of the year.,Little chinchillas are born furred and with eyes open.
1,What phylum do jellyfish belong to?,Cnidaria,Arthropoda,Chordata,Mollusca
0,What actor voiced the guinea pig character called Rodney in the 1998 comedy movie Dr. Dolittle?,Chris Rock,Jim Carrey,Chris Tucker,Eddie Murphy
0," Which of these characteristics is generally associated with carnivorous animals, particularly predators?",All of these,Aggressive behavior,Claws,Sharp teeth
0," Which of these names belongs to the fox species that is the second smallest fox species in the world, slightly smaller than a domestic cat?",All of these,Short-Tailed Fox,Coast Fox,California Channel Island Fox
2,This is where the Cobras ribs are situated.,Behind its head,"In its chest, around the middle of the body",Cobras have no ribs,In its tale
1,Which of these statements is true about the cockroaches ability to survive in hard times?,All of these,They are able to slow down their heart rate.,Cockroaches can survive radiation up to 15 times stronger than the lethal dose for humans.,Some roaches can survive without food for about one month.
0,To which animal class do octopuses belong?,Cephalopod,Mollusk,Coleoid,Nautiloid
2," What city is known as the White Squirrel Capital of the World, since it is home to the largest colony of albino squirrels?","Olney, Illinois","Marionville, Missouri","Columbus, Ohio","Kenton, Tennessee"
0,What is the common name for the pigeon that we see in the city streets and in our backyards?,Rock Dove,Mourning Dove,Common Dove,Fancy Dove
1,Which of these behaviors is typical of ant societies?,All of these,Ability to solve complicated problems,Communication between individuals,Division of labor
1,What frog is the most poisonous?,Dart Frog,Cane Toad,Corroboree Frog,Red-Eyed tree frog
0," Some mammals are able to glide and parachute, but bats are the only ones capable of flying.  What is the name of the membrane that forms the surface of their wings?",Patagium,Reticulum,Corticulum,Flagellum
2,This is the basic food of the sea. Billions upon billions of these organisms live in the sea.,Plankton,Seaweed,Crabs,Shrimp
0,Which of the following is not a breed of chicken?,Chinese Crested,Australorp,Cubalaya,Houdan
0," Venomous mammals do exist, although they are very rare. Which of these mammals is venomous?",All of these,European Mole,Cuban Solenodon,Platypus
1," What interesting resting posture does the Indian Treeshrew, a.k.a. Madras Treeshrew, have?",With its tail resting on its head,Sprawling on the ground as if its dead,Cuddling its rear legs,Hanging upside down from a branch
0," This very old cat breed, which occurred naturally in Turkey, has a slender body with medium length fur, usually white.",Turkish Angora,Ocicat,Cymric,Selkirk Rex
1,Which of the following characters is a chicken?,Foghorn Leghorn,Dori,Daffy,Kermit
0," Sometimes called the “hooked-finned” porpoise, this animal has a barely noticeable beak. It lives in the deep waters of the northern latitudes between North America and Asia, and is a very fast swimmer (up to 20 mph / 32 km/h). What is its name?",Pacific white-sided dolphin,Dusky dolphin,Dall’s porpoise,Pantropical dolphin
2,In this 2009 Walt Disney action comedy movie the main characters are guinea pigs.,G-Force,The Fast and the Furry,Darwin,Fluffy Spies
1," What type of animal is the Gold tegu, found in South America?",Reptile,Insect,Deer,Primate
0," What other common name is used for the New Caledonian bumpy gecko, a reptile found only on the southern end of the island of New Caledonia?",Gargoyle gecko,All of these,Devil gecko,Horny gecko
1,What is the name of the Tasmanian devil cartoon character from Looney Tunes by Warner Bros.?,Taz,Tess,Devlin,Tassie
2,These are typical Australian animals except one.,Sloth,Platypus,Dingo,Echidna
2,This Australian monotreme lays eggs and has a remarkable sense of electroception.,Platypus,Red kangaroo,Dingo,Emu
1,The red kangaroo appears on the Coat of Arms of Australia together with what other endemic Australian animal?,Emu,Platypus,Dingo,Koala
2," Guinea pigs are very intelligent, highly social animals that use special vocalization to communicate. What does their whistling or wheeking sound express?",Excitement,Danger or pain,Discomfort,Warning
0," The Ramphotyphlops braminus, a harmless blind snake species, found in Africa and Asia, is often mistaken for this animal.",Earthworm,Black mamba,Dog-faced water snake,Elephant Trunk Snake
2,This hairless cat breed originated in Russia.,All of these,Don Sphynx,Donskoy,Don Hairless
1," This snake, the only existing member of its family, can be found in Mexico and has a very muscular body and a shovel-shaped snout.",Loxocemidae bicolor,All of these,Dwarf boa,Pipe snake
2," What animal is considered the major enemy of the wolf in the wild, apart from humans?",Other wolves,Bear,Eagle,None of these
0,What time of day does the tiger shark usually hunt?,Nighttime,They hunt at different times throughout the day,Early morning,Mid morning
0,Which of the following is not a type of chipmunk?,Bushy-tailed,Long-eared,Eastern,Sonoma
0,What does the Latin word  omnivore stand for?,Eating everything,Fast eater,Eating constantly,Eating whatever
2,What is the only marsupial in the world that has a backwards pouch?,wombat,kangaroo,echidna,koala
1," Which of the following statements about echidnas, mammals native to Australia, is wrong?",Echidnas are marsupials.,Echidnas are covered with spines.,Echidnas have snouts.,Echidnas lay eggs.
2,What type of animal is a mudpuppy?,salamander,skink,eel,fish
0," This cat breed, developed by American breeder Ann Baker, is large and has blue eyes and soft fluffy coat with point coloration.",Ragdoll,LaPerm,Egyptian Mau,Savannah
0,This animal can clean its own ears with its 21-inch tongue.,Giraffe,Lizard,Elephant,Lion
2," Which of these marine mammals matches the description: Very large body, has tusks and whiskers?",Walrus,Tusked seal,Elephant seal,Polar bear
1,Which statement about elephants is untrue?,Elephants do not have great memories,Elephants sleep standing up,Elephants cry,There are some pink elephants in India
1," This dog, which was once used as a personal defense dog, police dog and war dog, is often mistakenly believed to be very aggressive.",Doberman Pinscher,Field Spaniel,Elo,Finnish Spitz
2," The female of this species is sometimes called a Blue Flyer, because of its bluish coloration.",red kangaroo,white heron,emu,kookaburra
2," Qantas, Australias largest airline company, has what Australian animal on its red-and-white logo?",Kangaroo,Koala,Emu,Tasmanian devil
1,Aztecs are known for wearing hummingbird talismans which symbolize which of the following?,All of these,Skill at arms,Energy,Sexual potency
1,In Europe goldfish were first introduced to what country?,Portugal,France,England,Italy
2," What dog breed has an elongated body, very short legs, short shiny coat and a long snout?",Dachshund,Dogo Guatemalteco,English Foxhound,Elo
1," This dog breed, developed in England, has an egg-shaped head, small eyes, and very strong muscular body with smooth short fur and short legs.",Bull Terrier,Cairn Terrier,English Shepherd,Wire Fox Terrier
0,What bacterium is believed to be the smallest living organism that is capable to grow and reproduce independently?,Mycoplasma genitalium,Staphylococcus aureus,Escherichia coli,Carsonella ruddii
1,No dinosaur fossils have been found on which one of these continents?,None of these,Antarctica,Europe,Africa
2,No lizard species live on which continent?,Antarctica,South America,Europe,Asia
1,In which of these studies are chinchillas used as animal models?,Studies of the auditory system,Studies of vocalization,Eyesight studies,Studies of the reproductive system
0,What class of horse breed does the Clydesdale horse belong to?,Draft Horse,Carriage Horse,Farm Horse,Saddle Horse
1,What is the #1 reason for the rhinos decline worldwide?,Poaching,Disease,Farming,Predators
0,Cockroaches belong to the order Blattaria. What is the meaning of the Latin word blatta?,Cockroach,Annoying,Fast,Pest
0,What does the word “hippopotamus” mean?,River horse,Water pig,Fat horse,River pig
2,This mammal is known for its black fur with a white stripe and for its apparent odor.,Skunk,Sloth,Ferret,Weasel
0,In what northern country did the Siberian Husky dog breed originate?,Russia,Norway,Finland,"Alaska, USA"
0," What kind of organism is the Greater Glider, a gliding animal indigenous to Australia?",Mammal,Reptile,Fish,Amphibian
0,The echidnas diet consists mainly of this group of animals.,Insects,Mammals,Fish,Birds
0,What is a female sheep called or known as?,ewe,colt,fleece,ram
1,What name is used for the social groups that chinchillas form when living in the wild?,Herds,Schools,Flocks,Troops
0,The Papillon is a small dog breed of the Toy group. What does the word Papillon mean in French?,Butterfly,Cherry,Flower,Angel
1,The sound of what musical instrument does the call of the Macaroni Penguin resemble?,Trumpet,Saxophone,Flute,Ocarina
0,Sloths have this number of toes and fingers depending on the family they belong to.,Two or three,Sloths do not have toes.,Four or five,One or two
0," For which of these animals is the following description true: The gestation period lasts 35–58 days. Smaller species have 5-6 babies, and larger species - 3-4 babies. The young are born blind.",Hedgehog,Lizard,Fox,Rabbit
2,What kind of animal is the venomous Gila monster that is indigenous to southwestern United States and northern Mexico?,Lizard,Invertebrate,Frog,Mammal
2,Three of these animals hibernate. Which one does not?,Sloth,Mouse,Frog,Snake
1,What is the weight range of normal mature platypuses?,From 0.7 to 2.4 kg,Between 3.2 and 4.6 kg,From 2.5 to 5.5 kg,Between 0.5 to 2.8 kg
2,What is the usual size range of mature ants?,From 0.75 to 52 millimeters,From 1.5 to 12 millimeters,From 3.5 to 61 millimeters,From 2 to 33 millimeters
1,What does the diet of all kangaroos consist of in general?,Plant matter,All of these,Fungi,Plant and animal matter
1," What is the difference between the male and the female Galah, a cockatoo bird native to Australia?",Males and females have different eye colour.,There is no difference between them.,Galah males are crested.,Galah females have shorter tails.
1,Which of these penguin species is the closest relative of the Magellanic Penguin?,All of these,African Penguin,Galapagos Penguin,Humboldt Penguin
2,Male Western Grey Kangaroos were nicknamed Stinkers because they have this kind of odor.,Curry,Sour cabbage,Garlic,Gasoline
0,Which of these statements about geckos is true?,All of these,Geckos have toe pads which help them climb smooth vertical surfaces.,Geckos can make chirping sounds.,Geckos feed on insects.
0," Although not all bear subspecies are vicious, there is a tendency for increase in bear attacks due to this factor.",Destruction of bears natural habitat,Pollution,Genetical mutation of bears,Hunting
1,Which of these statements are wrong about the reproduction of the Tasmanian devil?,The female has six nipples,The female gives birth to 20-30 young,Gestation lasts 21 days,None of these
0,To which chinchilla species do most of the domestic chinchillas belong?,Chinchilla lanigera,None of these,Giant Chinchilla,Chinchilla brevicaudata
1,Which of these is the largest species of penguins?,Emperor Penguin,King Penguin,Giant Penguin,Royal Penguin
2,Which lizard can squirt blood from the corners of its eyes in order to confuse and drive back its enemies?,Horned lizard,Anole,Gila monster,Komodo dragon
2,What organs do cockroaches use for the purpose of respiration?,Tracheae,All of these,Gills,Lungs
1,The word dinosaur is a combination of two Greek words. One word  means lizard. What does the other word mean?,Terrifying,Herbivorous,Godlike,Beautiful
2," Wolf pups are usually born with irises of this color, which changes with time.",Blue,Black,Golden,Green
0,What type of dog did Richard Nixon receive from a Texan while he was a candidate for Vice President?,Cocker Spaniel,German Shepherd,Golden Retriever,Welsh Corgy
1," The acouchis, small diurnal rodents found along riverbanks in the Amazon Rainforest, usually feed on this type of food.",Fruit,Insects,Grass,Nuts
1,Groundhogs are mostly herbivorous rodents that sometimes eat animal matter. What kind of animals would they feed on?,All of these,Larvae,Grasshoppers,Snails
0,The feathers of adult male ostriches are primarily of this color.,Black,White,Gray,Brown
0,What kangaroo species set a record by moving with 64 kilometers per hour (40 mph)?,All of these,Eastern Grey Kangaroo,Great Grey Kangaroo,Forester Kangaroo
1," This shark is considered a filter- feeder. Its diet consists mainly of plankton, krill, and macro-algae.",whale shark,bull shark,great white shark,pygmy shark
2,What color eyes do male box turtles commonly have?,red,blue,green,black
2," What color is the head of the South American stork Jabiru, whose body is predominantly white?",Black,Purple,Green,Red
2,What type of food does the guinea pig naturally feed on?,Grass,Grains,Green leaved,Nuts
1,Which one of these is not a species of zebra?,Savanna Zebra,Cape Mountain Zebra,Grevys Zebra,Plains Zebra
0,What animal is the largest macropod and one of Australias heraldic animals?,Red kangaroo,Pademelon,Grey kangaroo,Quokka
2,What is a group of lions called?,Pride,Family,Group,School
1,In what Latin American country did the Chihuahua dog breed originate?,Mexico,Cuba,Guatemala,Nicaragua
1,Which of these dinosaurs had dorsal plates and spikes?,Stegosaurus,Heloderma  suspectum,H. horridum,Hydrodamalis gigans
2,Name the two types of Chinese Crested dogs.,Hairless and Powderpuff,Water and Runner,Hairless and Hound,Sporty and Spotted
0,Chihuahuas are the only dogs to be born with what?,An incomplete skull,An extra leg tendon,Hairless inner ears,Two extra canine teeth
0,Which of these is not an actual breed of sheep?,Dakota,Scottish black-face,Hampshire,Merino
0,What was the largest  eagle ever found on Earth?,Haasts Eagle,Golden Eagle,Harpy Eagle,Bald Eagle
1,What is the literal translation of the word lanigera in the name of the chinchilla species Chinchilla lanigera?,Wearing a woolen coat,Long-tailed,Having long ears,Sleeping in straw
1,What is the only place in the world you can see platypuses in the wild?,Australia and Tasmania,South-eastern Asia,Hawaii Island,South America
0," This endangered turtle is the biggest of all living turtles, reaching a length of over 2.7 m (8.8 ft) and weight of 900 kg (2,000 lb).",Leatherback Sea Turtle,Kemps Ridley Turtle,Hawksbill Sea Turtle,Mesoamerican River Turtle
1," What type of insect is often referred to as a white ant, although it is not related to the ant species?",Termite,A type of small spider,Head louse,A type of albino wasp
1,What are the three basic parts of an ants body?,"Head, mesosoma, metasoma","Antennae, abdomen, thoraces","Head, abdomen, metasoma","Head, thorax, somatomy"
0," The cobras most recognizable feature is its hood, a flap of skin and muscle behind the head, believed to serve this purpose.",More threatening appearance,Balance control,Heat collection from sun rays,Camouflage
2,Which of these are not a function of a zebras stripes?,A warning sign to other zebras,Identification within the herd,Heat dissipation,Confusion of predators
1,Three of these Latin names are names of bears. Which is the odd one?,Felis silvestris catus,Melursus ursinus,Helarctos malayanus,Ursus minimus
1,What is an adult male rooster known as?,Rooster,Buck,Hen,Foul
2,A polar bear is used as the marketing icon for which of these popular products?,Klondike Bars,Maytag Freezers,Hoods Ice Cream,Popsicles
0,Which breed group does the Chinese Crested dog belong to?,Toy,Sporting,Hound,Non-Sprint
1,Which of the following is a characteristic of the nutria?,Large orange teeth,Webbed front feet,Huge black eyes,Flat beaver like tale
1,Which of these animals are among the many marine mammals that use songs for the purposes of communication?,All of these,Blue Whale,Humpback whale,Beluga
2,Which of these is only a dog food brand?,Cesar,Eukanuba,Iams,Purina
1,What are the anatomical differences between African elephants and Asian elephants?,All of these,In the tusks,In the ears,In the body size
0,What time of year do nutrias breed?,All year round,In the winter months,In the Fall,In the spring
2,Which elephant subspecies is the largest on the planet?,Savanna Elephant,Sri Lankan Elephant,Indian Elephant,Forest Elephant
0,Which is the smallest elephant subspecies on the planet?,Sumatran Elephant,Forest Elephant,Indian Elephant,Sri Lankan Elephant
0," In what ocean can the 50 species of Exocoetidae, also known as flying fish, be found?",All of these,Atlantic ocean,Indian ocean,Pacific ocean
1,What large mammal is the national animal of India?,Bengal tiger,Water Buffalo,Indian Rhinoceros,Indian Elephant
0,What country was home to the Moa?,New Zealand,Puerto Rico,Indonesia,Madagascar
0,What type of animal is a lamprey?,fish,worm,insect,amphibian
2,How are most foxes generally classified according to their diet?,Omnivores,Specialized eaters,Insectivores,Carnivores
2,Whiteflies generally feed on what?,Leaves,Fruit,Insects,Carrion
2,Three of these species shed their skin. Which one does not?,Penguins,Snakes,Insects,Crustaceans
1,What type of food do Tasmanian devils prefer in the wild?,Carrion,Sheep,Insects,Fish
0," What is the main food source for the sloth, an omnivorous mammal living in Central and South America?",Leaves,Small reptiles,Insects,Fruit
0,What type of food do chinchillas prefer to feed on in the wild?,All of these,Plants,Insects,Fruits
0,Which animals have the most unique species endemic to Australia?,Amphibians,Mammals,Insects,Reptiles
0," Adult Goliath beetles, found in Africas tropical forests, feed on what?",Fruits and tree sap,Leaves and grasses,Insects and other invertebrates,Carrion
1,Warner Brothers highest grossing film of 1954 was about enormous ants that threatened a small town in the USA. What was the title of this movie?,Them!,Ants!,Invasion,Invaders
2,In what European country did the Rough Collie dog breed originate?,Scotland,Germany,Ireland,France
2,What fox species is considered to be the smallest on the planet?,Fennec Fox,Short-Tailed Fox,Island Fox,Coast Fox
2,What was the main reason for the extinction of the Moa?,It was hunted by man for food.,There was not enough room on the island for so many large birds,It could easily be caught by predators.,It got to large to support itself.
0," What kind of unique activity is characteristic of the African Pygmy Mouse, the smallest rodent in the world?",It piles up pebbles in front of its burrow.,It sings at night.,It disguises its young using leaves.,It starts dancing when it feels threatened by a predator.
2," Which of these statements is true about the capybara, the largest rodent on the planet, indigenous to South America?",None of these,Its front legs are a little longer than the rear legs.,It has 16 teeth.,It has a short tail.
1," Which of these statements is true about the slow loris, a primate which is both poisonous and venomous?",All of these,It covers its young with a toxin to keep them from being eaten.,It has a venomous bite.,It secretes a toxin from the glands on the inside of its elbows.
0,What unusual anatomical feature does the male ostrich possess?,It has a copulatory organ.,It has four testicles.,It has a very small horn on its head.,All of these
2," What does the South American snake Lachesis muta, commonly known as South American bushmaster, do when it feels threatened?",It starts vibrating its tail.,It spreads its neck.,It hisses and dances.,All of these
