1,What is the meaning of the term apex predator which is related to carnivorous animals?,A predator that has no predators itself.,A very skilled predator that is highly specialized in killing animals.,It is a term for a human being.,An animal which consumes the highest number of animal species.
0," Which of these statements is true about the Black dog, a ghost-like creature popular in the folklores of the British Isles?",All of these,It is believed to appear at night.,It is associated with the Devil.,It is considered a portent of death.
0," What makes the Scarlet Macaw, a parrot species indigenous to South America, unsuitable for a pet?",All of these,It is very demanding.,It is extremely noisy.,It is a high maintenance pet.
1,Which of these statements is true about the Black garden ant?,All of these,Each colony has only one queen.,It is found in Europe.,It is found in North America and Asia.
2,Which of these statements is true about the Western black widow spider?,It is extremely venomous.,The female always eats the male after mating.,It is native to Madagascar.,All of these
0,Which of these statements is true about the Jacksons Chameleon?,It gives birth to 8-30 live young.,It lays about 15-30 eggs that hatch in 10 days.,It lays about 5-10 eggs that hatch immediately.,It gives birth to 2-3 live young.
0,What does the Tasmanian devil do when it feels stressed or threatened?,It produces a strong odour,It starts screaming,It plays dead,It attacks
0,Why do cats like to sleep in the sun?,To make up for the drop in body temperature when they sleep,To keep from shedding so much,It reminds them of being kittens,Because they can hear better when they are warm
0,The Chihuahua Gidget is famous for what reason?,It was a mascot for Taco Bell.,Paris Hilton has it as a pet.,It was a fill-in mascot for the Georgia Bulldogs.,It was a mascot for Taco John.
0," Which one of these statements about the Seismosaurus, the Earth-shaking lizard, is wrong?",Its hind legs were shorter than its front legs.,It could reach 33 meters in length.,It was recognized as a species in 1991.,It was herbivorous.
0," Which of these statements is NOT true about the Common Raven, a popular omnivorous bird?",It wouldnt eat birds,It wouldnt reject carrion,It would feed on animal feces,It feeds on human food waste
0,In which European country did the Dalmatian dog breed originate?,Croatia,Netherlands,Italy,Denmark
1,Which of these statements is not true about the Indian Elephant?,All of these,It has a smaller trunk than the African Elephant.,"Its abdomen is quite large compared to its skull, unlike African elephants.",It has larger ears than the African Elephant.
2," Where does the kookaburra, a common Australian bird, get its name from?",The aboriginal name for it,The food it eats,Its appearance,The sound it makes
2,What feature of the turtle species Dermochelys coriacea makes it easily distinguishable from all the other sea turtles?,It has no shell.,It has a very long tail.,Its body has very vivid colors.,It has a horn on its head.
0," How did the glass lizard, also known as glass snake, get its interesting name?",It breaks easily.,It can climb on glass.,Its eyes are glass-like.,It is almost transparent.
1," What interesting physical feature does the Nicobar Bulbul, endemic to the Nicobar Islands of India, possess?",It has a dark cap on its head.,It has a bright red beak.,Its tail is very long and yellow.,Its eyes are purple.
1,What term is used to refer to the young of the kangaroo?,Joey,Mary,Jack,Wally
1,In what country was the goldfish first domesticated?,China,Egypt,Japan,India
1,Which of these is NOT a species of rhinoceros?,African Rhino,Indian Rhino,Javan Rhino,Sumatran Rhino
1," In the 1980s, who voiced the character of Dino, the pet dinosaur in the animated series The Flintstones?",Mel Blanc,Frank Welker,Jean Vander Pyl,Alan Reed
0,These creatures look like flowers as they grow attached to rocks. Their tentacles open like fleshy petals and contract whenever danger is near.,Sea Anemones,Kelp,Jellyfish,Sponges
2," Some small spider species, as well as the young of larger species, are known for floating in the wind. What is this activity commonly known as?",Ballooning,Skydiving,Jetting,Drifting
1,Which of these books about prehistoric animals and dinosaurs was written by Arthur Conan Doyle?,The Lost World,Dinosaur Planet,Jurassic Park,Dinotopia
1," Which one of these movies tells the story of Littlefoot, an Apatosaurus in search of the Great Valley where dinosaurs can live in peace?",The Land Before Time,Walking With Dinosaurs,Jurassic Park,King Kong
1," This dog breed, which originated in Mongolia and China, has very thick fluffy fur and a blue-black tongue.",Chow Chow,Jonangi,Kai Ken,Hokkaido
2,Which of these animals is NOT native to Australia?,Dingo,Frilled-neck lizard,Kangaroo,Bilby
0,What is the difference between the digestion of kangaroos and the digestion of ruminants?,Kangaroos do not release methane.,Nothing,Kangaroos need to consume some animal matter to provide essential digestive bacteria.,Kangaroos digest plant matter five times faster than ruminants do.
2,Chameleons are lizards that can change their colour. What does Chameleon mean in Greek?,Earth lion,Green melon,Karma lion,Colourful
1,In May 2009 the Tasmanian devil was declared to be endangered because this disease had almost wiped out its population.,Facial cancer,AIDS,Kawasaki disease,Rabies
0,What creature is considered the most venomous on the planet?,Box jellyfish,Fat-tailed scorpion,Killer bee,Cone snail
2,What does the word “mantis” mean?,Prophet or fortuneteller,Savage insect,Killer or hunter,Leaflike
0,Why do cats seem to be attracted to the one person who doesnt like cats?,Kitty sees that person as unintimidating,Kitty wants to annoy them,Kitty thinks that person has food,Kitty wants to win them over
2," This cat breed, which appeared naturally in Thailand, has a slim body and short fur with point coloration.",Siamese,Himalayan,Korat,Burmese
1,This cat breed with curly hair appeared as a natural mutation in the United States.,LaPerm,Selkirk Rex,Kurilian Bobtail,American Curl
0," This freshwater mammal, found only in the Yangtze River, is the most endangered (even possibly extinct) cetacean and one of the most endangered species in the world.",Chinese River Dolphin,Ganges River Dolphin,La Plata Dolphin,Amazon River Dolphin
2,Which of the following is not a breed of dog?,Ferret terrier,Pom-a-poo,Lakeland terrier,Fox terrier
1,Most bear species are omnivores and their diet consists mainly of what?,Mast,Tubers,Leaves,Grass
2,What is the average lifespan of a lion living in the wild?,10 -15 years,20 - 30 years,Less than 10 years,Greater than 30 years
0,Which of the following behaviors is not typical for the Chinese Crested dog?,Pant to keep cool,Bark,Lift a leg to urinate,Wag their tail when happy
0,What is the breed of animal created from the crossing of a female lion and a male tiger?,Tigon,Tigen,Liger,Liges
1,The does “cheetah” mean translated from Sanskrit?,Spotted One,Fast,Lightning,Stealth cat
0," Translated in English, what does the name of the chinchilla mean?",Little Chincha,Little Chilean,Little Chile,Of Chincha
2,The largest penguin species on the planet is the Emperor Penguin. What is the smallest one?,All of these,Blue Penguin,Little Penguin,Fairy Penguin
1,Snakes belong to the following category.,Reptiles,Invertebrates,Lizards,Mammals
1," The name brontosaurus is derived from the Greek words sauros, which means lizard, combined with another word. What does the word bronte mean?",Thunder or roar,Large,Long neck,Poetic
1,Males of this whale species have one tooth that can grow to be 10 feet (3 m) long.,Narwhal,Strapped-tooth whale,Long-finned pilot whale,Blainville’s beaked whale
1,What chinchilla species has become extinct as a result of fur hunting?,Giant Chinchilla,All of these,Long-tailed Chinchilla,Red-nosed Chinchilla
1,What do male lions have which females do not possess?,A mane,An extra tooth,Longer nails,Distinguished eyes
1,The largest family of whales is the beaked whales (Ziphiidae). Most of the scarce information about this family has been found from dead specimens. Their teeth are the most distinctive aspect of these whales; most have only 2-4 oversized teeth. Which whale’s teeth erupt from bulges in the lower jaw?,Blainville’s beaked whale,Stejneger’s beaked whale,Longman’s beaked whale,Arnoux’s beaked whale
2,What is the meaning of the word kangaroo according to legend?,I dont understand you.,I dont know.,Look at this!,What is this?
2," The Cobra is at the top of the food chain, with only two main predators -- one is man and the other is this animal.",Mongoose,Jackal,Lynx,Eagle
0,Which one of these dinosaurs was carnivorous?,Eoraptor,Diplodocus,Maiasaura,Triceratops
2,This exotic cat breed was developed in Kenya by crossbreeding between a Serval and a domestic cat.,Savannah,Bengal,Maine Coon,Egyptian Mau
2,One of these is not a true breed of cat. Which one?,French Twist,Pixie-bob,Maine coon,Ragdoll
0," This shark was believed to be extinct, until it was found on the coast of Japan in 1898.",goblin shark,cookie cutter shark,mako shark,angel shark
2,What was the name of Fraisers fathers dog on the hit TV show set in Seattle?,Eddie,Niles,Marty,Skip
1,Which is the largest subspecies of ostrich on the planet?,Red-necked Ostrich,Southern Ostrich,Masai Ostrich,Middle Eastern Ostrich
1," Although jellyfish may seem to you calm and harmless, an encounter with some species may leave you in excruciating pain and even kill you in minutes. Which of the following species of jellyfish is venomous enough to kill a man?",Box jellyfish,Sea nettle,Mastigias,Medusa Jellyfish
1,What do skunks eat in the wild?,All of these,Insects,Meat,Fruit
1,What actor directed and starred in the popular 1990 movie Dances with Wolves?,Kevin Costner,Sean Connery,Mel Gibson,Harrison Ford
2,Which of these things is something you should never feed your dog?,Chocolate,Coconuts,Milk,Raw meat
2,Human beings have 23 pairs of  chromosomes. Which animal has the most chromosomes?,hermit crabs,minke whale,millipedes,elephants
1,Which term refers to the group formed by frogs and amphibians?,Herps,Drosophillia,Mollusks,Nematodes
2,Which of these lizard species is not endangered?,Eastern Bearded Dragon,Blunt-nosed Leopard Lizard,Mona Ground Iguana,Komodo Dragon
0,What is the deadliest jellyfish in the world?,Box Jellyfish,Lions Mane Jellyfish,Moon Jellyfish,Sea Nettle
0,How long does it take for a sloth to digest its food completely?,A month or more,1 week,More than 2 weeks,About 3 months
2,What type of Indian animals are included in the so-called Big Four selection?,Poisonous snakes,Largest insects,Most dangerous animals,Largest land animals
1,Beavers are the second largest rodents in the world after which animal?,Capybara,Muskrat,Mountain Marmot,Sea Otter
1,In which of these African environments are hyenas NOT found?,Desert,Forests,Mountains,Grasslands
1,All of these animals are omnivorous except one.,Snail,Fox,Mouse,Opossum
1,What other common name is used for a mudpuppy?,Waterdog,Water Canine,Mud Dog,Salamander
2," The representatives of this type of dolphins have very small eyes, making them virtually blind. They rely on echolocation to find food and swim in turbid waters. They include the baiji and boto. What are they called?",River dolphins,Oceanic dolphins,Muddy dolphins,Blind dolphins
1,Which of these is NOT a species of crocodile?,African Crocodile,Nile Crocodile,Mugger Crocodile,American Crocodile
1," In Islamic history, 570 A.D. was The Year of the Elephant. Which of these happened in that year?",Muhammad was born,The Qur’an was written in book form,Muhammad received his first revelation,Muhammad became ill and died
2,What is another name for a nutria?,Coypu,Beaver,Muskrat,Rat
2,Which of these tiny bugs is considered the smallest beetle in the world?,Scydosella musawasensis,None of these,Nanosella,Vitusella fijiensis
1," What is the common name of the Quoll, a carnivorous marsupial native to Australia and Papua New Guinea?",Native cat,Native rat,Native fox,Native dog
0," In the book Jurassic Park, the fictional island Isla Nublar, where recreated dinosaur species live, is situated in which part of the world?",Near Costa Rica,Near Japan,Near Chile,Near Spain
2,In what part of their body do Tasmanian devils store body fat?,Tail,Abdomen,Neck,Back
1," In what geographical area is the Rock monitor lizard, or Legavaan, found?",Africa,South America,New Guinea,Australia
1,How is the chinchilla classified according to the peak of its activeness throughout the day?,Crepuscular,None of these,Nocturnal,Duirnal
0,The Black wolf is actually a color variant of which wolf species?,Grey wolf,White wolf,None of these,Brown wolf
0,What type of animal is the cockroach when classified according to the peak of its activeness?,Nocturnal,Diurnal,None of these,Crepuscular
1,Which of these regarding the reproduction of raccoons is correct?,Pregnancy can last from 54 to 70 days.,The male brings food for the young.,None of these,Females usually give birth to only one kit.
1," This reptile, endemic to new Zealand, is the only surviving rhynchocephalian.",Tuatara,Perisssodactyl,None of these,Kephalosaurus
1,What statement is true about elephants mammary glands?,They have one pair of mammary glands.,They have two pairs of mammary glands.,None of these,They have only one mammary gland.
1,How many subspecies of Red Fox are found in India?,3,2,None. Red Fox are not native to India.,1
0," In what geographical region can you find the Paradise Flying Snake, also called Paradise Tree Snake?",Asia,Central and South America,North America,Australia
1," The smallest turtle in the world, the Speckled Padloper Tortoise, inhabits which of these areas?",South Africa,South Asia,North Australia,South America
1,Name the largest mollusk and the largest invertebrate in the world?,Colossal squid,Giant African snail,North Pacific Giant Octopus,Giant squid
2,What is the meaning the word which stands for fox in many languages?,Tail,Fur,Nose,Cunning
1,Which shark is the fastest swimmer?,mako shark,goblin shark,nurse shark,sandtiger shark
2,What is the largest fish in existence?,Whale shark,Manta ray,Ocean sunfish,Basking shark
1,Which of these mollusks is able to glide over in air for up to 50 meters (164 feet)?,Squid,Oyster,Octopus,Slug
0,What breed is known as the favourite breed of Queen Elizabeth II?,Welsh Corgi,Border Collie,Old English Sheepdog,Australian Cattle Dog
0," How are the young Box turtles classified according to their diet, which differs from the diet of mature Box turtles?",Carnivores,Specialized eaters,Omnivores,Herbivores
0,Snakes are this kind of animals.,Carnivorous,Herbivorous,Omnivorous,Vegetarian
2," Where does the Giant Cowbird, a passerine bird found in South America, lay its eggs?",In other birds nests,On rocks,On balconies,On the ground
0,Which of these is true about raccoons?,They use their front paws to examine their food and remove unwanted parts,They do not produce enough saliva to moisten their food,Only wild raccoons douse their food,All of these
0,What color goldfish were most prized by the Chinese royalty several centuries ago?,Yellow,Silver,Orange,Red
0,What color are wild goldfish?,Green,Silver,Orange,Yellow
0," The blue whale is the largest animal, but what is the largest toothed whale on the planet?",Sperm whale,Cuviers Beaked Whale,Orca,All of these
1," Although the grizzly bear is on the flag of this state, the last grizzly was shot there in 1922.",California,Nevada,Oregon,Idaho
2,Triceratops is the official State Dinosaur of which state?,Wyoming,Utah,Oregon,Nevada
0,A specialist in snakes is called one of these.,Ophiologist,Pisciculturist,Ornithologist,Herpetologist
0,The White Snake is a fairy tale included in the collection of fairy tales by this author.,Brothers Grimm,Andrew Lang,Oscar Wilde,Hans Christian Andersen
2," According to Guinness Book of World Records, the heaviest wild bear was caught in 1960 and weighed 1,960 lbs (890 kg). What was its length?","Over 11 feet (3,40 m) tall","Over 12 feet (3,70 m) tall","Over 9 feet (2,70 m) tall",Over 10 feet (3 m) tall
0,Studies of raccoons intelligence have shown that raccoons are capable of performing this activity.,Opening locks,Understanding spoken words,Painting,Differentiating sounds
1,What is the white tigers scientific name?,Panthera tigris,Pantha,Panthera tigis,Panthera tiger
1,In what European city is the popular bronze statue Capitoline Wolf located?,Rome,Madrid,Paris,London
1,What were the dodos closest living relatives in nature?,Pigeons,Chickens,Parrots,Turkeys
2,Which one of these dinosaurs was bigger than a dog?,Triceratops,Saltopus,Parvicursor,Microraptor
2,What is the common name for baby sharks?,pups,calves,pecks,cubs
1," The representatives of this dog breed are small, have long white silky fur and are also known as Roman Ladies Dogs.",Maltese,Norrbottenspets,Phalene,Mudi
2,This dog breed was developed as a gun dog in Canada?,Labrador Retriever,Mountain Cur,Pharaoh Hound,Lakeland Terrier
2,Why are pigeon nests or eggs rarely seen?,Pigeons are cliff dwellers and build their nests in high places.,Pigeons do their best to conceal nests.,Pigeons are picky and only build nests high up in certain types of trees.,Pigeons dont build nests.
0,Which of the following color of egg is incorrect for a chicken egg?,black,white,pink,blue
2,What do you call a group of flamingos?,Pat,Family,Pink,Flock
0,What color is a polar bears skin?,Black,White,Pink,Yellow
2," What cat breed, which originated in France, has thick waterproof grey fur, gold-colored eyes and large muscular body?",Chartreux,Chausie,Pixie-bob,LaPerm
1," Elephants intertwine their trunks with the trunks of other elephants, much like a handshake. What does an elephant not do with its trunk?",drink through it like through a straw,caress a baby elephant,place food in their mouth,grab enemies and fling them away
0,Venomous and poisonous are two different terms. What does the term venomous refer to?,Animals that inject venom,Animals that are deadly when eaten,Plants and animals that secrete venom and are harmful when touched,All of these
1,Which of these statements is true about the diet of the platypus?,Platypuses are carnivores.,Platypuses are herbivores.,Platypuses are specialized eaters.,Platypuses are omnivores.
0,Platypuses use this method to detect their prey.,They use electrolocation.,They rely on their well-developed sense of smell.,Platypuses rely mainly on their hearing.,They rely on their exceptional eyesight.
1,How do platypuses reproduce?,Platypuses lay eggs.,None of these,Platypuses reproduce asexually.,Platypuses are metatherian.
2,Captive raccoons are known for performing this vacuum activity.,Dousing their food,Scratching their belly,Playing dead,All of these
0," Apart from jumping, kangaroos are known for fleeing from predators using this tactic.",Swimming,All of these,Playing dead,Climbing
1,One of these is not a true breed of chicken. Which one?,Red-tailed,Hamburg,Plymouth Rock,Leghorn
0," The name of cobras, which are very venomous, comes from the Portuguese cobra de capello. What does this mean?",Snake with hood,Poisonous hat,Poisonous nose,Snake with nose
0," This bear, also known as a Silvertip bear, is native to North America.",Grizzly Bear,Panda Bear,Polar Bear,Red Panda Bear
0," This animal is the heaviest member of its family, and also one of the smallest marine mammals.",Sea otter,Sea pig,Polar mouse,None of these
1,What name is commonly used to refer to the guinea pig?,Cavy,Netty,Poppy,Willy
2,What is a group of hyenas called?,Clan,Pack,Posse,Giggle
1,The coyote lives in North America and also goes by this name.,Prairie Wolf,Desert Dog,Prairie Dog,Small Wolf
2,In 1966 was found the first ant fossil. From which geological period did it come from?,Cretaceous,Pennsylvannian,Pre-Fermaceous,Jurasic
1,Which of these is one of the nicknames of the tiger shark?,Wastebasket of the Sea,Garbage Can of the Deep,Predators  that will kill,Killers of the Ocean
1,Dinosaurs lived during which geologic era?,Mesozoic,Cretazoic,Protozoic,Holozoic
2,Which of these dog breeds originated in Hungary?,All of these,Pumi,Puli,Mudi
2,The puggle is a mix between a beagle and what dog?,pug,papillion,puli,poodle
2,What animal is considered the smallest mammal in length on the planet?,Kittis Hog-nosed Bat,None of these,Pygmy Jerboa,Etruscan Shrew
2,The North American Beaver is Canadas National symbol that adorns which Canadian coin?,Nickle,Penny,Quarter,Dime
0,What was the name of the zoo in which the last known Thylacine was placed in 1936?,Hobart Zoo,Queensland Zoo,Queen Elizabeth Zoological Gardens,Australia Zoo
2," The Capybara is the largest rodent in the world. What is the meaning of its name, derived from a word of the Guaraní language?",Master of the grasses,River keeper,Rabbit pig,Water squirrel
1,The beagle was developed mainly for tracking what animal?,rabbits,squirrels,raccoons,coyotes
0,This tiny frog is the smallest amphibian in the world.,Brazilian Gold Frog,Monte Iberia Eleuth,Rana Minuscula,Small Frog
0," The usage of raw sugars, including brown sugar, is not recommended when preparing artificial nectar for Hummingbirds. Why?",Raw sugars contain iron.,All of these,Raw sugars contain zinc.,They contain harmful heavy metals.
2," What color is the crest on the head of the Southern Rockhopper Penguin, which is known for having red eyes?",Yellow,Bright blue,Red,Green and blue
2," This small nocturnal animal, whose natural habitat are the deserts of Northern Africa, is known to jump not only for hunting or protection, but also for pleasure.",Fennec,Cape Fox,Red Fox,Bengal Fox
0," What distinctive feature is characteristic of the crocodile species called gharial, or Indian gavial?",Narrow snout,Very short tail,Red spots on its back,Purple scales
0," This bird is the fastest animal on the planet in its hunting method, the stoop.",Peregrine Falcon,Bald Eagle,Red-tailed Hawk,Golden Eagle
1,What type of animal is the smallest vertebrate?,Fish,Mammals,Reptiles,Amphibians
2," What does the diet of the Great Blue Heron, found in North and Central America, consist of?",All of these,Birds,Reptiles,Small mammals
2,Which of these body systems do jellyfish NOT have?,all of these,osmoregulatory,respiratory,circulatory
2," These worms are not in fact worms, but bivalves. They enter wood as larvae, where they remain and grow, burrowing through the wood.",Shipworms,Sea Mice,Ribbon Worms,Lugworms
0," This popular dolphin often herds fish onto the beach in order to eat the stranded fish. As a result, the teeth on one side (usually the right) are worn down due to eating sand as well as the fish. Which is this dolphin?",Bottlenose dolphin,Stranded dolphin,Right-sided dolphin,Spotted dolphin
0,Which of these names does not refer to a sloth?,Rikki-Tikki-Tavi,Ritto,Rit,Ridette
2," This family of cetaceans has representatives like the vaquita, the harbor, and spectacled type. They are shy and stay away from boats; however, they are particularly susceptible to fishing lines, nets, and other pollution. Which is the family?",Porpoises,Pilot whales,River dolphins,Dolphins
1," This small, graceful member of the antelope family is an extraordinary jumper - while leaping, it touches the rocky terrain of its South African habitats only with the tip of its hooves, resembling a dance.",Klipspringer,Oribi,Roan Antelope,Scimitar Oryx
1,Which of these is not a subspecies of giraffe?,East African Giraffe,Somali Giraffe,Rothschilds Giraffe,Kordofan Giraffe
1,"en you call a dog, he comes right over to you. When you call a cat, she________________.",takes a message,climbs the curtains,runs away from you,thinks its dinner time
0,Which of these European countries is not home to any wild native reindeer?,Switzerland,Finland,Russia,Scotland
2,This chemical is found in the venom of most ants and some other insects.,Formic acid,Formaldehyde,Saxitoxin,Cyanic acid
2," This sea animal, widely considered the most valuable shellfish, is common in shallow, warmer waters of all oceans.",Oyster,Shrimp,Scallop,Lobster
1," Also called Sea Biscuit, this animal lives in deeper water half-buried in the sand.",Sand Dollar,Star Fish,Scallop,Mussel
2,What is a group of jellyfish called?,bloom,herd,school,pack
2,Which of the following cartoon dogs was a beagle?,Snoopy,Courage,Scooby Doo,Clifford
1,Representatives of three of these species produce venom of their own. Which is the odd species?,Mosquitos,Lizards,Scorpions,Frogs
0,What animal is is the only strictly-marine herbivorous mammal in the world?,All of these,Dugong,Sea pig,Sea cow
2," This marine mammal is known as the pilot whale, but it is not actually a whale. What type of animal is it?",Dolphin,Walrus,Seal,Otter
1,What is the major type of food that Hummingbirds depend on for their survival?,Nectar,All of these,Seeds,Buds
1,What does the diet of ostriches consist of?,All of these,Insects,Seeds,Grass
0,What is the most important sense for raccoons?,Sense of touch,Vision,Sense of smell,Hearing
1,What group of dogs does the beagle belong to?,hound,retrievers,setters,terriers
0,A dog should never be left with a child under this age because the child may injure the dog or him/herself.,five,ten,seven,three
0,How many times per year is a healthy female guinea pig able to give birth?,Five times,Twice,Seven times,Once
0,Which of these animals swims the fastest?,Dolphin,Flounder,Shark,Jellyfish
0,This is the result of the gravitational pull from the moon and sun.,Tides,Migration of certain species of whales,Shoreline,Waves
2,What type of coat do beagles have?,medium,long,short,depends on the dog
